VariableSpecificUUID,AggregationInterval,AggregationIntervalUnitCV,AggregationStatisticCV,AmountUnitCV,MaximumAmountUnitCV,ReportYearStartMonth,ReportYearTypeCV,VariableCV,VariableSpecificCV
WYag_V1,1,Annual,Cumulative,AFY,AFY,1,WaterYear,Reservoirs and Gages,Consumptive Use_Annual_Agricultural Consumptive Use_Groundwater
WYag_V2,1,Annual,Cumulative,AFY,AFY,1,WaterYear,Reservoirs and Gages,Consumptive Use_Annual_Agricultural Consumptive Use_Surface Water
WYag_V3,1,Annual,Cumulative,AFY,AFY,1,WaterYear,Reservoirs and Gages,Consumptive Use_Annual_Domestic Use_Groundwater
WYag_V4,1,Annual,Cumulative,AFY,AFY,1,WaterYear,Reservoirs and Gages,Consumptive Use_Annual_Domestic Use_Surface Water
WYag_V5,1,Annual,Cumulative,AFY,AFY,1,WaterYear,Reservoirs and Gages,Consumptive Use_Annual_Industrial Use_Groundwater
WYag_V6,1,Annual,Cumulative,AFY,AFY,1,WaterYear,Reservoirs and Gages,Consumptive Use_Annual_Industrial Use_Surface Water
WYag_V7,1,Annual,Cumulative,AFY,AFY,1,WaterYear,Reservoirs and Gages,Consumptive Use_Annual_Municipal Use_Cross Basin Diversion
WYag_V8,1,Annual,Cumulative,AFY,AFY,1,WaterYear,Reservoirs and Gages,Consumptive Use_Annual_Municipal Use_Groundwater
WYag_V9,1,Annual,Cumulative,AFY,AFY,1,WaterYear,Reservoirs and Gages,Consumptive Use_Annual_Municipal Use_Surface Water
